{
  "schema_version": 1,
  "created_at": "2026-05-08T05:15:35Z",
  "version": "0.1.0",
  "task": "wikitext2_word_lm",
  "metric": "dev_perplexity",
  "aggregate": {
    "mean": 21516.002996337706,
    "std": 3305.7061554611096,
    "n": 3
  },
  "runs": [
    {
      "seed": 0,
      "manifest": {
        "task": "wikitext2_word_lm",
        "framework": "pytorch",
        "torch_version": "2.5.1+cu121",
        "seed": 0,
        "block_size": 16,
        "d_model": 32,
        "num_heads": 2,
        "ffn_dim": 64,
        "num_layers": 1,
        "total_params": 1074016,
        "vocab_size": 16384,
        "epochs": 1,
        "batch_size": 32,
        "learning_rate": 0.0005,
        "train_tokens_used": 4000,
        "train_windows_used": 150,
        "eval_windows_used": 300,
        "dev_loss_nats": 9.909309768676758,
        "dev_perplexity": 20116.78396365468,
        "windows_per_sec": 52.73681817602678,
        "train_elapsed_sec": 2.8443126678466797,
        "epoch_stats": [
          {
            "epoch": 0,
            "mean_loss": 9.922659111022949,
            "elapsed_sec": 2.8442981243133545
          }
        ],
        "dataset": "WikiText-2 raw v1 (smerity.com mirror)",
        "tokenizer": "Rustral vocab.txt + whitespace lowercased split"
      }
    },
    {
      "seed": 1,
      "manifest": {
        "task": "wikitext2_word_lm",
        "framework": "pytorch",
        "torch_version": "2.5.1+cu121",
        "seed": 1,
        "block_size": 16,
        "d_model": 32,
        "num_heads": 2,
        "ffn_dim": 64,
        "num_layers": 1,
        "total_params": 1074016,
        "vocab_size": 16384,
        "epochs": 1,
        "batch_size": 32,
        "learning_rate": 0.0005,
        "train_tokens_used": 4000,
        "train_windows_used": 150,
        "eval_windows_used": 300,
        "dev_loss_nats": 9.859536170959473,
        "dev_perplexity": 19140.009683933826,
        "windows_per_sec": 57.68519516051615,
        "train_elapsed_sec": 2.60032057762146,
        "epoch_stats": [
          {
            "epoch": 0,
            "mean_loss": 9.996683502197266,
            "elapsed_sec": 2.6003100872039795
          }
        ],
        "dataset": "WikiText-2 raw v1 (smerity.com mirror)",
        "tokenizer": "Rustral vocab.txt + whitespace lowercased split"
      }
    },
    {
      "seed": 2,
      "manifest": {
        "task": "wikitext2_word_lm",
        "framework": "pytorch",
        "torch_version": "2.5.1+cu121",
        "seed": 2,
        "block_size": 16,
        "d_model": 32,
        "num_heads": 2,
        "ffn_dim": 64,
        "num_layers": 1,
        "total_params": 1074016,
        "vocab_size": 16384,
        "epochs": 1,
        "batch_size": 32,
        "learning_rate": 0.0005,
        "train_tokens_used": 4000,
        "train_windows_used": 150,
        "eval_windows_used": 300,
        "dev_loss_nats": 10.138212394714355,
        "dev_perplexity": 25291.21534142461,
        "windows_per_sec": 57.45553705755091,
        "train_elapsed_sec": 2.6107144355773926,
        "epoch_stats": [
          {
            "epoch": 0,
            "mean_loss": 10.044990730285644,
            "elapsed_sec": 2.6106913089752197
          }
        ],
        "dataset": "WikiText-2 raw v1 (smerity.com mirror)",
        "tokenizer": "Rustral vocab.txt + whitespace lowercased split"
      }
    }
  ]
}
