{
  "schema_version": 1,
  "created_at": "2026-05-10T06:00:00Z",
  "version": "0.1.0",
  "task": "llm_generate",
  "metric": "tokens_per_sec",
  "aggregate": {
    "mean": 42.5,
    "std": 3.2,
    "n": 3
  },
  "runs": [
    {
      "seed": 0,
      "out_dir": "out/llm_evidence/gpt2/seed_0",
      "manifest": {
        "framework": "rustral_llm",
        "task": "llm_generate",
        "git_sha": "0000000000000000000000000000000000000001",
        "model_id": "hf-internal-testing/tiny-random-GPT2",
        "backend": "ndarray",
        "dtype": "f32",
        "seed": 0,
        "hub_snapshot_ms": 120.0,
        "model_init_ms": 15.0,
        "tokenizer_load_ms": 8.0,
        "tokenizer_hash_fnv1a": "a1b2c3d4e5f67890",
        "prompt_fnv1a": "b2c3d4e5f6789012",
        "prompt_tokens": 4,
        "max_new_tokens": 16,
        "generated_new_tokens": 16,
        "first_token_ms": 40.0,
        "decode_wall_ms": 380.0,
        "tokens_per_sec": 42.1,
        "note": "Curated example only; regenerate manifests via rustral-llm generate --out-dir after real Hub run."
      }
    },
    {
      "seed": 1,
      "out_dir": "out/llm_evidence/gpt2/seed_1",
      "manifest": {
        "framework": "rustral_llm",
        "task": "llm_generate",
        "git_sha": "0000000000000000000000000000000000000001",
        "model_id": "hf-internal-testing/tiny-random-GPT2",
        "backend": "ndarray",
        "dtype": "f32",
        "seed": 1,
        "hub_snapshot_ms": 95.0,
        "model_init_ms": 14.0,
        "tokenizer_load_ms": 7.5,
        "tokenizer_hash_fnv1a": "a1b2c3d4e5f67890",
        "prompt_fnv1a": "c3d4e5f678901234",
        "prompt_tokens": 4,
        "max_new_tokens": 16,
        "generated_new_tokens": 16,
        "first_token_ms": 38.0,
        "decode_wall_ms": 370.0,
        "tokens_per_sec": 43.2,
        "note": "Curated example only; regenerate manifests via rustral-llm generate --out-dir after real Hub run."
      }
    },
    {
      "seed": 2,
      "out_dir": "out/llm_evidence/gpt2/seed_2",
      "manifest": {
        "framework": "rustral_llm",
        "task": "llm_generate",
        "git_sha": "0000000000000000000000000000000000000001",
        "model_id": "hf-internal-testing/tiny-random-GPT2",
        "backend": "ndarray",
        "dtype": "f32",
        "seed": 2,
        "hub_snapshot_ms": 110.0,
        "model_init_ms": 16.0,
        "tokenizer_load_ms": 8.2,
        "tokenizer_hash_fnv1a": "a1b2c3d4e5f67890",
        "prompt_fnv1a": "d4e5f67890123456",
        "prompt_tokens": 4,
        "max_new_tokens": 16,
        "generated_new_tokens": 16,
        "first_token_ms": 41.0,
        "decode_wall_ms": 390.0,
        "tokens_per_sec": 41.0,
        "note": "Curated example only; regenerate manifests via rustral-llm generate --out-dir after real Hub run."
      }
    }
  ]
}
