{
  "schema_version": 1,
  "created_at": "2026-05-07T11:50:49Z",
  "version": "0.1.0",
  "task": "sst2_classifier",
  "metric": "dev_accuracy",
  "aggregate": {
    "mean": 0.509174,
    "std": 0.0,
    "n": 3
  },
  "runs": [
    {
      "seed": 0,
      "out_dir": "out/nlp_real/sst2/seed_0",
      "manifest": {
        "task": "sst2_classifier",
        "model_type": "transformer_encoder",
        "git_sha": "b5ea5d7daf7b87491efc01a95e8e76ce64b3a523",
        "seed": 0,
        "seq_len": 32,
        "d_model": 64,
        "num_heads": 4,
        "ffn_dim": 128,
        "num_layers": 2,
        "total_params": 593410,
        "max_vocab": 8192,
        "vocab_size": 8192,
        "epochs": 3,
        "batch_size": 32,
        "learning_rate": 0.0005,
        "train_examples": 6920,
        "dev_examples": 872,
        "dataset_hash_fnv1a": "1f4e99728a7bde5a",
        "dev_loss": 0.828782,
        "dev_accuracy": 0.509174,
        "samples_per_sec": 204.604492,
        "train_elapsed_sec": 101.46405,
        "dataset": "SST-2 (binary, HuggingFace SetFit/sst2 mirror)",
        "tokenizer": "rustral-data WordLevelTokenizer (whitespace, lowercased)",
        "quick_mode": false
      }
    },
    {
      "seed": 1,
      "out_dir": "out/nlp_real/sst2/seed_1",
      "manifest": {
        "task": "sst2_classifier",
        "model_type": "transformer_encoder",
        "git_sha": "b5ea5d7daf7b87491efc01a95e8e76ce64b3a523",
        "seed": 1,
        "seq_len": 32,
        "d_model": 64,
        "num_heads": 4,
        "ffn_dim": 128,
        "num_layers": 2,
        "total_params": 593410,
        "max_vocab": 8192,
        "vocab_size": 8192,
        "epochs": 3,
        "batch_size": 32,
        "learning_rate": 0.0005,
        "train_examples": 6920,
        "dev_examples": 872,
        "dataset_hash_fnv1a": "1f4e99728a7bde5a",
        "dev_loss": 0.699548,
        "dev_accuracy": 0.509174,
        "samples_per_sec": 184.498901,
        "train_elapsed_sec": 112.520996,
        "dataset": "SST-2 (binary, HuggingFace SetFit/sst2 mirror)",
        "tokenizer": "rustral-data WordLevelTokenizer (whitespace, lowercased)",
        "quick_mode": false
      }
    },
    {
      "seed": 2,
      "out_dir": "out/nlp_real/sst2/seed_2",
      "manifest": {
        "task": "sst2_classifier",
        "model_type": "transformer_encoder",
        "git_sha": "b5ea5d7daf7b87491efc01a95e8e76ce64b3a523",
        "seed": 2,
        "seq_len": 32,
        "d_model": 64,
        "num_heads": 4,
        "ffn_dim": 128,
        "num_layers": 2,
        "total_params": 593410,
        "max_vocab": 8192,
        "vocab_size": 8192,
        "epochs": 3,
        "batch_size": 32,
        "learning_rate": 0.0005,
        "train_examples": 6920,
        "dev_examples": 872,
        "dataset_hash_fnv1a": "1f4e99728a7bde5a",
        "dev_loss": 0.692561,
        "dev_accuracy": 0.509174,
        "samples_per_sec": 185.625626,
        "train_elapsed_sec": 111.838005,
        "dataset": "SST-2 (binary, HuggingFace SetFit/sst2 mirror)",
        "tokenizer": "rustral-data WordLevelTokenizer (whitespace, lowercased)",
        "quick_mode": false
      }
    }
  ]
}
