{
  "schema_version": 1,
  "created_at": "2026-05-07T11:50:49Z",
  "version": "0.1.0",
  "task": "wikitext2_word_lm",
  "metric": "dev_perplexity",
  "aggregate": {
    "mean": 10643.917968666667,
    "std": 472.52016225631826,
    "n": 3
  },
  "runs": [
    {
      "seed": 0,
      "out_dir": "out/nlp_real/wikitext2/seed_0",
      "manifest": {
        "task": "wikitext2_word_lm",
        "model_type": "transformer_lm",
        "git_sha": "b5ea5d7daf7b87491efc01a95e8e76ce64b3a523",
        "seed": 0,
        "block_size": 32,
        "d_model": 64,
        "num_heads": 4,
        "ffn_dim": 128,
        "num_layers": 2,
        "total_params": 2182528,
        "max_vocab": 16384,
        "vocab_size": 16384,
        "epochs": 1,
        "batch_size": 32,
        "learning_rate": 0.0005,
        "train_tokens_used": 50000,
        "train_windows": 2000,
        "train_windows_used": 2000,
        "valid_windows": 213854,
        "eval_windows_used": 20000,
        "dataset_hash_fnv1a": "b088631d3ede2aff",
        "dev_loss_nats": 9.231141,
        "dev_perplexity": 10210.185547,
        "windows_per_sec": 13.353875,
        "train_elapsed_sec": 149.769257,
        "dataset": "WikiText-2 raw v1 (smerity.com mirror)",
        "tokenizer": "rustral-data WordLevelTokenizer (whitespace, lowercased)",
        "quick_mode": false
      }
    },
    {
      "seed": 1,
      "out_dir": "out/nlp_real/wikitext2/seed_1",
      "manifest": {
        "task": "wikitext2_word_lm",
        "model_type": "transformer_lm",
        "git_sha": "b5ea5d7daf7b87491efc01a95e8e76ce64b3a523",
        "seed": 1,
        "block_size": 32,
        "d_model": 64,
        "num_heads": 4,
        "ffn_dim": 128,
        "num_layers": 2,
        "total_params": 2182528,
        "max_vocab": 16384,
        "vocab_size": 16384,
        "epochs": 1,
        "batch_size": 32,
        "learning_rate": 0.0005,
        "train_tokens_used": 50000,
        "train_windows": 2000,
        "train_windows_used": 2000,
        "valid_windows": 213854,
        "eval_windows_used": 20000,
        "dataset_hash_fnv1a": "b088631d3ede2aff",
        "dev_loss_nats": 9.318967,
        "dev_perplexity": 11147.458984,
        "windows_per_sec": 15.304955,
        "train_elapsed_sec": 130.676636,
        "dataset": "WikiText-2 raw v1 (smerity.com mirror)",
        "tokenizer": "rustral-data WordLevelTokenizer (whitespace, lowercased)",
        "quick_mode": false
      }
    },
    {
      "seed": 2,
      "out_dir": "out/nlp_real/wikitext2/seed_2",
      "manifest": {
        "task": "wikitext2_word_lm",
        "model_type": "transformer_lm",
        "git_sha": "b5ea5d7daf7b87491efc01a95e8e76ce64b3a523",
        "seed": 2,
        "block_size": 32,
        "d_model": 64,
        "num_heads": 4,
        "ffn_dim": 128,
        "num_layers": 2,
        "total_params": 2182528,
        "max_vocab": 16384,
        "vocab_size": 16384,
        "epochs": 1,
        "batch_size": 32,
        "learning_rate": 0.0005,
        "train_tokens_used": 50000,
        "train_windows": 2000,
        "train_windows_used": 2000,
        "valid_windows": 213854,
        "eval_windows_used": 20000,
        "dataset_hash_fnv1a": "b088631d3ede2aff",
        "dev_loss_nats": 9.266164,
        "dev_perplexity": 10574.109375,
        "windows_per_sec": 11.659025,
        "train_elapsed_sec": 171.540924,
        "dataset": "WikiText-2 raw v1 (smerity.com mirror)",
        "tokenizer": "rustral-data WordLevelTokenizer (whitespace, lowercased)",
        "quick_mode": false
      }
    }
  ]
}
